{"approval_policy_version":"qualityci-approval-policy-0.1","artifact_subject_hash":"f1e174486549975d5cc1276ac447ffe279a2c57242021097ca181b0a863b330a","case_id":"QCI-NHTSA-24V152-SYN-001","contract_version":"qualityci-approval-subject-0.1","controlled_reference_policy_hash":"8e4a49f2e395516e7609708c057b0f315f0cf3d2c9e8bebbe78ab6ff0cbdee8f","event_id":"ECO-SYN-001","event_revision":"2","execution_nonce":"EXEC-A05-DEMO-R001-0001","operations_hash":"35169dd300a8e609f3811070bdd143d4795de384207ea94374dda356ca0f03bf","pre_case_subject_hash":"b2ec4a2a1bfdbbf3a3495d1c0a3fa6c347b42a45ab627bb8b1b0e39cdd3c4214","purpose_code":"APPLY_APPROVED_RESOLUTION","purpose_text":"经人工批准，同步SOP规格与版本，并让检验记录引用新SOP。","purpose_text_hash":"673ea6057dc63cecf1b987c8ce3b344945229dcc87559d2bbd36f7cf242afd72","required_role_claims":["PROCESS_OWNER","QUALITY_MANAGER"],"resolution_description_hash":"673ea6057dc63cecf1b987c8ce3b344945229dcc87559d2bbd36f7cf242afd72","resolution_id":"RES-SYN-001","scope_code":"EXACT_SUBJECT","use_policy":"SINGLE_REPLAY","validation_approval_policy_hash":"8444d0c0a97d717428ef7fe229debd1c5e42720df9f0226908a5468abba69ed8"}